{
  "$schema": "../schemas/wake-vectors.schema.json",
  "$comment": "Generated by node contract/tools/generate.mjs. Edit contract/tools, not these files.",
  "family": "wake",
  "contract": 3,
  "section": "10",
  "reference": "tools/wake-plan.mjs",
  "notes": [
    "prefixes: valid says whether the text is a LAN prefix of section 10.1; contains[i] whether addresses[i], a dotted-quad IPv4 address, is inside it. An invalid prefix contains nothing.",
    "broadcasts: valid says whether a broadcast entry is a dotted-quad IPv4 address a client sends to.",
    "plans: documentText is fixtures/controller-document.wake-defaults.json. here.addresses are this device's addresses as a.b.c.d/length or a.b.c.d; one that is not dotted IPv4, or is in 127/8, is ignored. helpers maps a helper to its last status read this session: ready (with actions, action id to kind, when the status listed them), asleep (noRoute or hostUnreachable), unusable (authenticationFailed, hostKeyChanged, hostKeyUnknown, interpreterMissing, agentMissing, badRequest), not-driven (no system of it approved here), unknown (not read, or any other ending); a helper missing from the map is unknown. holds are the wake holds recorded for the target.",
    "plans: steps run in order. A direct step is {kind: direct, broadcast, ports, repeats}; a helper step is {kind: helper, machine, action, readFirst}, readFirst when the helper is unknown and is read once just before its step. Every key is present, null where it does not apply. skipped gives the reason for the direct step (no-mac, ambiguous, unplaced, elsewhere) and for each helper entry (missing, self, duplicate, asleep, unusable, no-action, held, checked in that order), and ends with {kind: helpers, reason: none} when there is no direct step and no helper at all.",
    "plans: placement by wake.lanPrefix uses the matcher the prefixes group pins. old-box's prefix 10.0.0 ends in 0, where matching it as text happens to agree with section 10.1, so no plan tells the two apart: place machines with the same function the prefixes adapter runs.",
    "readiness: pollStartsMs are the milliseconds after a send at which the readiness polls start."
  ],
  "groups": {
    "prefixes": [
      {
        "name": "dotted-with-dot",
        "purpose": "Three octets and the trailing dot editors write: the /24, and nothing that merely starts with the same characters.",
        "consumers": [
          "mac",
          "desktop",
          "android"
        ],
        "tags": [
          "finding:a9"
        ],
        "input": {
          "prefix": "192.168.1.",
          "addresses": [
            "192.168.1.7",
            "192.168.10.7",
            "192.168.100.7"
          ]
        },
        "expect": {
          "valid": true,
          "contains": [
            true,
            false,
            false
          ]
        }
      },
      {
        "name": "dotted-without-dot",
        "purpose": "Without the dot it is the same /24, matched on the octet boundary, so 192.168.10.7 is outside it.",
        "consumers": [
          "mac",
          "desktop",
          "android"
        ],
        "tags": [
          "finding:a9"
        ],
        "input": {
          "prefix": "192.168.1",
          "addresses": [
            "192.168.1.7",
            "192.168.10.7"
          ]
        },
        "expect": {
          "valid": true,
          "contains": [
            true,
            false
          ]
        }
      },
      {
        "name": "one-octet",
        "purpose": "One octet is a /8, matched on the octet boundary: 100.64.0.1 is not in 10.",
        "consumers": [
          "mac",
          "desktop",
          "android"
        ],
        "tags": [
          "finding:a9"
        ],
        "input": {
          "prefix": "10",
          "addresses": [
            "10.20.30.40",
            "100.64.0.1"
          ]
        },
        "expect": {
          "valid": true,
          "contains": [
            true,
            false
          ]
        }
      },
      {
        "name": "one-octet-with-dot",
        "purpose": "One octet and a dot is the same /8.",
        "consumers": [
          "mac",
          "desktop",
          "android"
        ],
        "tags": [
          "finding:a9"
        ],
        "input": {
          "prefix": "10.",
          "addresses": [
            "10.0.0.1",
            "110.0.0.1"
          ]
        },
        "expect": {
          "valid": true,
          "contains": [
            true,
            false
          ]
        }
      },
      {
        "name": "cidr-24",
        "purpose": "A CIDR /24 holds its own 256 addresses and not its neighbours'.",
        "consumers": [
          "mac",
          "desktop",
          "android"
        ],
        "tags": [
          "finding:a9"
        ],
        "input": {
          "prefix": "192.168.10.0/24",
          "addresses": [
            "192.168.10.200",
            "192.168.1.200",
            "192.168.11.1"
          ]
        },
        "expect": {
          "valid": true,
          "contains": [
            true,
            false,
            false
          ]
        }
      },
      {
        "name": "cidr-12",
        "purpose": "A CIDR length that is not a multiple of eight is matched on the bit boundary.",
        "consumers": [
          "mac",
          "desktop",
          "android"
        ],
        "tags": [
          "finding:a9"
        ],
        "input": {
          "prefix": "172.16.0.0/12",
          "addresses": [
            "172.31.255.1",
            "172.32.0.1"
          ]
        },
        "expect": {
          "valid": true,
          "contains": [
            true,
            false
          ]
        }
      },
      {
        "name": "cidr-32",
        "purpose": "A /32 holds exactly one address.",
        "consumers": [
          "mac",
          "desktop",
          "android"
        ],
        "tags": [
          "finding:a9"
        ],
        "input": {
          "prefix": "192.168.1.5/32",
          "addresses": [
            "192.168.1.5",
            "192.168.1.50"
          ]
        },
        "expect": {
          "valid": true,
          "contains": [
            true,
            false
          ]
        }
      },
      {
        "name": "empty",
        "purpose": "An empty prefix would match every address with \"starts with\". It is no prefix.",
        "consumers": [
          "mac",
          "desktop",
          "android"
        ],
        "tags": [
          "finding:a9"
        ],
        "input": {
          "prefix": "",
          "addresses": [
            "192.168.1.7"
          ]
        },
        "expect": {
          "valid": false,
          "contains": [
            false
          ]
        }
      },
      {
        "name": "leading-space",
        "purpose": "Surrounding whitespace is not trimmed: the text is not a prefix and never matches.",
        "consumers": [
          "mac",
          "desktop",
          "android"
        ],
        "tags": [
          "finding:a9"
        ],
        "input": {
          "prefix": " 192.168.1.",
          "addresses": [
            "192.168.1.7"
          ]
        },
        "expect": {
          "valid": false,
          "contains": [
            false
          ]
        }
      },
      {
        "name": "full-address",
        "purpose": "A full address without a length is not a prefix: it would be a /32 to one reader and a text prefix of 192.168.1.50 to another.",
        "consumers": [
          "mac",
          "desktop",
          "android"
        ],
        "tags": [
          "finding:a9"
        ],
        "input": {
          "prefix": "192.168.1.5",
          "addresses": [
            "192.168.1.5",
            "192.168.1.50"
          ]
        },
        "expect": {
          "valid": false,
          "contains": [
            false,
            false
          ]
        }
      },
      {
        "name": "leading-zero",
        "purpose": "An octet with a leading zero is octal to some parsers and decimal to others, so it is neither.",
        "consumers": [
          "mac",
          "desktop",
          "android"
        ],
        "tags": [
          "finding:a9"
        ],
        "input": {
          "prefix": "192.168.01.",
          "addresses": [
            "192.168.1.7"
          ]
        },
        "expect": {
          "valid": false,
          "contains": [
            false
          ]
        }
      },
      {
        "name": "octet-too-large",
        "purpose": "An octet above 255 is no octet, so the text is no prefix and matches nothing.",
        "consumers": [
          "mac",
          "desktop",
          "android"
        ],
        "tags": [
          "finding:a9"
        ],
        "input": {
          "prefix": "256.1.",
          "addresses": [
            "10.0.0.1"
          ]
        },
        "expect": {
          "valid": false,
          "contains": [
            false
          ]
        }
      },
      {
        "name": "double-dot",
        "purpose": "Two trailing dots are not the one optional dot.",
        "consumers": [
          "mac",
          "desktop",
          "android"
        ],
        "tags": [
          "finding:a9"
        ],
        "input": {
          "prefix": "192.168.1..",
          "addresses": [
            "192.168.1.7"
          ]
        },
        "expect": {
          "valid": false,
          "contains": [
            false
          ]
        }
      },
      {
        "name": "length-too-long",
        "purpose": "A CIDR length above 32.",
        "consumers": [
          "mac",
          "desktop",
          "android"
        ],
        "tags": [
          "finding:a9"
        ],
        "input": {
          "prefix": "192.168.1.0/33",
          "addresses": [
            "192.168.1.7"
          ]
        },
        "expect": {
          "valid": false,
          "contains": [
            false
          ]